survey,year,raw_var_name,question_text,position,var_kind,module,missing_values_raw,source_file,parse_notes
BRFSS,2016,FALLINJ2_Cat2,Recode of FALLINJ2: How many falls caused injury past 12 months.,396,,,9,OHA_BRFSS_2016_Data_Dictionary.xlsx,
BRFSS,2016,FLSHOT5,Risk factor for respondents aged 65+ who have had a flu shot within the past 12 months,389,,,9,OHA_BRFSS_2016_Data_Dictionary.xlsx,
BRFSS,2016,FPREASLX_Cat,FPREASLX Catagories for web-tables,381,,,"77.00, 99.00",OHA_BRFSS_2016_Data_Dictionary.xlsx,
BRFSS,2016,hcvu65,Respondents ages 18-64 who have or do not have health care coverage,382,,,9,OHA_BRFSS_2016_Data_Dictionary.xlsx,
BRFSS,2016,hisp,Hispanic,402,,,,OHA_BRFSS_2016_Data_Dictionary.xlsx,
BRFSS,2016,hisp_ct,<none>,409,,,,OHA_BRFSS_2016_Data_Dictionary.xlsx,
BRFSS,2016,HTIN4,Calculated variable for reported HTIN4 in inches,365,,,"7777.00, 9999.00",OHA_BRFSS_2016_Data_Dictionary.xlsx,
BRFSS,2016,HTM4,Calculated variable for reported HTIN4 in meters,366,,,,OHA_BRFSS_2016_Data_Dictionary.xlsx,
BRFSS,2016,ill30d2,Recode of ill30d which asks about status of physical health,383,,,99,OHA_BRFSS_2016_Data_Dictionary.xlsx,
BRFSS,2016,inca30d3,Recode of incap30d which asks about effect of physical or mental health upon daily activities,386,,,99,OHA_BRFSS_2016_Data_Dictionary.xlsx,
BRFSS,2016,incap30d_r,Recode of INCAP30D to include all 0's: days in  the past 30 in which  poor physical or mental health limited usual activities,385,,,,OHA_BRFSS_2016_Data_Dictionary.xlsx,
BRFSS,2016,incomg,Annual Household Income,378,,,9,OHA_BRFSS_2016_Data_Dictionary.xlsx,
BRFSS,2016,ltasthm,Risk Factor for Lifetime Asthma Prevalence,364,,,9,OHA_BRFSS_2016_Data_Dictionary.xlsx,
BRFSS,2016,ment30d2,Recode of ment30d which asks about status of mental health,384,,,99,OHA_BRFSS_2016_Data_Dictionary.xlsx,
BRFSS,2016,MJ30X2_Cat,MJ30X2: Catagories for web tables,392,,,"77.00, 99.00",OHA_BRFSS_2016_Data_Dictionary.xlsx,
BRFSS,2016,MJANY_Cat,MJANY: Catagories for web tables,391,,,"777.00, 999.00",OHA_BRFSS_2016_Data_Dictionary.xlsx,
BRFSS,2016,mjcurrent,CALC: Current Marijuana use (past 30 days),394,,,,OHA_BRFSS_2016_Data_Dictionary.xlsx,
BRFSS,2016,mjever,CALC: Ever used marijuana in any form,393,,,,OHA_BRFSS_2016_Data_Dictionary.xlsx,
BRFSS,2016,multrcnt,Multiple Mentions of Race-incl hisp preceding race,410,,,,OHA_BRFSS_2016_Data_Dictionary.xlsx,
BRFSS,2016,multrcnt_RO,Multiple Mentions of Race (w/o hisp),411,,,,OHA_BRFSS_2016_Data_Dictionary.xlsx,
BRFSS,2016,NHawPI,Pacific Islander,407,,,,OHA_BRFSS_2016_Data_Dictionary.xlsx,
BRFSS,2016,OthrRace,Other Race,408,,,,OHA_BRFSS_2016_Data_Dictionary.xlsx,
BRFSS,2016,pneumo2,Risk factor for respondents aged 65+ who have ever had a pneumonia shot,390,,,9,OHA_BRFSS_2016_Data_Dictionary.xlsx,
BRFSS,2016,RACETHX_EXP2,"NEW Expanded Race-Ethnicity Detailed Recode, from RACE1 & RACEBESTX2 with added info from HISP",413,,,,OHA_BRFSS_2016_Data_Dictionary.xlsx,
BRFSS,2016,RACETHX2,"NEW Race-Ethnicity Reporting Recode, from RACE1 & RACEBESTX2 with added info from HISP",417,,,,OHA_BRFSS_2016_Data_Dictionary.xlsx,
BRFSS,2016,region_2016,Regions used in 2016 weighting; could use for reporting,418,,,99,OHA_BRFSS_2016_Data_Dictionary.xlsx,
BRFSS,2016,RFBING5,"Calculated variable for binge drinkers (males having five or more drinks on one occasion, females having four or more drinks on one occasion).",359,,,9,OHA_BRFSS_2016_Data_Dictionary.xlsx,
BRFSS,2016,rfbldst,Respondents ages 50+ who have not had a blood stool test within two years,372,,,9,OHA_BRFSS_2016_Data_Dictionary.xlsx,
BRFSS,2016,RFBMI5,Risk Factor for Overweight/Obese,370,,,9,OHA_BRFSS_2016_Data_Dictionary.xlsx,
BRFSS,2016,RFDRHV5,Heavy drinkers (adult men having more than two drinks per day and adult women having more than one drink per day).,361,,,9,OHA_BRFSS_2016_Data_Dictionary.xlsx,
BRFSS,2016,rfhlth,Risk Factor: Adults with good or better health,387,,,9,OHA_BRFSS_2016_Data_Dictionary.xlsx,
BRFSS,2016,rfmam2y,Women 40+ having mammograms in last two years,425,,,9,OHA_BRFSS_2016_Data_Dictionary.xlsx,
BRFSS,2016,rfmam2y50,Women 50+ having mammograms in last two years,426,,,9,OHA_BRFSS_2016_Data_Dictionary.xlsx,
BRFSS,2016,RFPSA21,Men aged 40 and older who have not had a PSA test within two years,401,,,9,OHA_BRFSS_2016_Data_Dictionary.xlsx,
BRFSS,2016,rfseat2,Seatbelt use: Always or nearly always,397,,,9,OHA_BRFSS_2016_Data_Dictionary.xlsx,
BRFSS,2016,rfseat3,Seatbelt use: Always,398,,,9,OHA_BRFSS_2016_Data_Dictionary.xlsx,
BRFSS,2016,rfsigm2,Respondents aged 50+ who have never had a Sigmoidoscopy or colonoscopy,373,,,9,OHA_BRFSS_2016_Data_Dictionary.xlsx,
BRFSS,2016,rfsmok2,Risk factor: Respondents that reported having smoked at least 100 cigarettes in their lifetime and currently SMOKDAY2 - CDC,422,,,9,OHA_BRFSS_2016_Data_Dictionary.xlsx,
BRFSS,2016,roomcat3,Recode of ssroom: How many hours per week spent in a room where people are smoking,420,,,"7, 9",OHA_BRFSS_2016_Data_Dictionary.xlsx,
BRFSS,2016,sleephrsrec,"Recode of SLEEPHRS:  On the average, how many hours of sleep do you get in a 24-hour period?",419,,,9,OHA_BRFSS_2016_Data_Dictionary.xlsx,
BRFSS,2016,smokenu2,Recode of smokenum which asks every-day smokers how many cigarettes per average day are smoked,423,,,"7, 9",OHA_BRFSS_2016_Data_Dictionary.xlsx,
BRFSS,2016,smoker2,Computed Smoking Status - CDC,421,,,9,OHA_BRFSS_2016_Data_Dictionary.xlsx,
BRFSS,2016,starts,Recode of sstarts2x:  At what age did you start smoking?,424,,,"77, 99",OHA_BRFSS_2016_Data_Dictionary.xlsx,
BRFSS,2016,surveycore,Survey Versions in CDC Core data,412,,,,OHA_BRFSS_2016_Data_Dictionary.xlsx,
BRFSS,2016,white,White,403,,,,OHA_BRFSS_2016_Data_Dictionary.xlsx,
BRFSS,2016,WTKG3,Calculated variable for reported weight in kilograms,367,,,,OHA_BRFSS_2016_Data_Dictionary.xlsx,
BRFSS,2016,wtrk_A_ao,<none>,429,,,,OHA_BRFSS_2016_Data_Dictionary.xlsx,
BRFSS,2016,wtrk_AC_aoc,<none>,428,,,,OHA_BRFSS_2016_Data_Dictionary.xlsx,
BRFSS,2016,wtrk_C_c,<none>,427,,,,OHA_BRFSS_2016_Data_Dictionary.xlsx,
BRFSS,2016,xrace_exp2,<none>,414,,,,OHA_BRFSS_2016_Data_Dictionary.xlsx,
BRFSS,2016,xraceth,"Race-Ethnicity Reporting Recode, from RACE1 & RACEBESTX2 with HISP (precedence over race)",416,,,,OHA_BRFSS_2016_Data_Dictionary.xlsx,
BRFSS,2016,XRACETH_EXP,"Expanded Race-Ethnicity Detailed Recode, from RACE1 & RACEBESTX2 with HISP (precedence over race)",415,,,,OHA_BRFSS_2016_Data_Dictionary.xlsx,
BRFSS,2017,ACEDEPRS,"M31.1. Did you live with anyone who was depressed, mentally ill, or suicidal?",1,,,"7, 9",OHA_BRFSS_2017_Data_Dictionary.xlsx,
BRFSS,2017,ACEDIVRC,M31.5. Were your parents separated or divorced?,2,,,"7, 9",OHA_BRFSS_2017_Data_Dictionary.xlsx,
BRFSS,2017,ACEDRINK,M31.2. Did you live with anyone who was a problem drinker or alcoholic?,3,,,"7, 9",OHA_BRFSS_2017_Data_Dictionary.xlsx,
BRFSS,2017,ACEDRUGS,M31.3. Did you live with anyone who used illegal street drugs or who abused prescription medications?,4,,,"7, 9",OHA_BRFSS_2017_Data_Dictionary.xlsx,
BRFSS,2017,ACEHURT,"M31.7. Before age 18, how often did a parent or adult in your home ever hit, beat, kick, or physically hurt you in any way? Do not include spanking. Would you say...",5,,,"7, 9",OHA_BRFSS_2017_Data_Dictionary.xlsx,
BRFSS,2017,ACEHVSEX,"M31.11. How often did anyone at least 5 years older than you or an adult, force you to have sex?",6,,,"7, 9",OHA_BRFSS_2017_Data_Dictionary.xlsx,
BRFSS,2017,ACEPRISN,"M31.4. Did you live with anyone who served time or was sentenced to serve time in a prison, jail, or other correctional facility?",7,,,"7, 9",OHA_BRFSS_2017_Data_Dictionary.xlsx,
BRFSS,2017,ACEPUNCH,"M31.6. How often did your parents or adults in your home ever slap, hit, kick, punch or beat each other up?",8,,,"7, 9",OHA_BRFSS_2017_Data_Dictionary.xlsx,
BRFSS,2017,ACESWEAR,"M31.8. How often did a parent or adult in your home ever swear at you, insult you, or put you down?",9,,,"7, 9",OHA_BRFSS_2017_Data_Dictionary.xlsx,
BRFSS,2017,ACETOUCH,"M31.9. How often did anyone at least 5 years older than you or an adult, ever touch you sexually?",10,,,"7, 9",OHA_BRFSS_2017_Data_Dictionary.xlsx,
BRFSS,2017,ACETTHEM,"M31.10. How often did anyone at least 5 years older than you or an adult, try to make you touch them sexually?",11,,,"7, 9",OHA_BRFSS_2017_Data_Dictionary.xlsx,
BRFSS,2017,ADDEPEV2,"C6.10. (Ever told) you have a depressive disorder including depression, major depression, dysthymia, or minor depression?",12,,,"7, 9",OHA_BRFSS_2017_Data_Dictionary.xlsx,
BRFSS,2017,ADSLEEP,"M09.2. Over the last 2 weeks, how many days have you had trouble falling asleep OR staying asleep OR sleeping too much?",13,,,"77, 99",OHA_BRFSS_2017_Data_Dictionary.xlsx,
BRFSS,2017,AGE,C8.2. What is your age?,14,,,"7, 9",OHA_BRFSS_2017_Data_Dictionary.xlsx,
BRFSS,2017,AGEGRPX,C8.2B. In which of these age categories do you belong?,15,,,"77, 99",OHA_BRFSS_2017_Data_Dictionary.xlsx,
BRFSS,2017,ALCDAY5,"C11.1. During the past 30 days, how many days per week or per month did you have at least one drink of any alcoholic beverage such as beer, wine, a malt beverage or liquor?",16,,,"777, 999",OHA_BRFSS_2017_Data_Dictionary.xlsx,no value labels in Variables sheet or Values sheet
BRFSS,2017,ARSYM3MN,OR55.2. Did your joint symptoms FIRST begin more than 3 months ago?,17,,,"7, 9",OHA_BRFSS_2017_Data_Dictionary.xlsx,
BRFSS,2017,ARSYMP30,"OR55.1. During the past 30 days, have you had symptoms of pain, aching, or stiffness in or around a joint?",18,,,"7, 9",OHA_BRFSS_2017_Data_Dictionary.xlsx,
BRFSS,2017,ARTHDIS2,"C7.2. In this next question, we are referring to work for pay. Do arthritis or joint symptoms now affect whether you work, the type of work you do, or the amount of work you do?",19,,,"7, 9",OHA_BRFSS_2017_Data_Dictionary.xlsx,
BRFSS,2017,ARTHEDU,M06.4. Have you EVER taken an educational course or class to teach you how to manage problems related to your arthritis or joint symptoms?,20,,,"7, 9",OHA_BRFSS_2017_Data_Dictionary.xlsx,
BRFSS,2017,ARTHEXER,M06.3. Has a doctor or other health professional ever suggested physical activity or exercise to help your arthritis or joint symptoms?,21,,,"7, 9",OHA_BRFSS_2017_Data_Dictionary.xlsx,
BRFSS,2017,ARTHSOCL,"C7.3. During the past 30 days, to what extent has your arthritis or joint symptoms interfered with your normal social activities, such as going shopping, to the movies, or to religious or social gatherings?",22,,,"7, 9",OHA_BRFSS_2017_Data_Dictionary.xlsx,
BRFSS,2017,ARTHWGT,M06.2. Has a doctor or other health professional EVER suggested losing weight to help your arthritis or joint symptoms?,23,,,"7, 9",OHA_BRFSS_2017_Data_Dictionary.xlsx,
BRFSS,2017,ARTTODAY,"M06.1. Earlier you indicated that you had arthritis or joint symptoms. Thinking about your arthritis or joint symptoms, which of the following best describes you TODAY?",24,,,"7, 9",OHA_BRFSS_2017_Data_Dictionary.xlsx,
BRFSS,2017,ASPUNSAF,OR153.3.  Do you have a health problem or condition that makes taking aspirin unsafe for you?,25,,,"7, 9",OHA_BRFSS_2017_Data_Dictionary.xlsx,
BRFSS,2017,ASTHMA3,C6.4. (Ever told) you had asthma?,26,,,"7, 9",OHA_BRFSS_2017_Data_Dictionary.xlsx,
BRFSS,2017,ASTHNOW,C6.5. Do you still have asthma?,27,,,"7, 9",OHA_BRFSS_2017_Data_Dictionary.xlsx,
BRFSS,2017,AVEDRNK2,"C11.2. One drink is equivalent to a 12 ounce beer, a 5 ounce glass of wine, or a drink with one shot of liquor.  During the past 30 days, on the days when you drank, about how many drinks did you drink on the average?",28,,,"77, 99",OHA_BRFSS_2017_Data_Dictionary.xlsx,
BRFSS,2017,BIRTHSEXX,"1. Some of the questions in the survey depend on sex, so please tell me... What was your sex at birth?",29,,,"7, 9",OHA_BRFSS_2017_Data_Dictionary.xlsx,
BRFSS,2017,BLDSTOOL,OR117.1.  A blood stool test is a test that may use a special kit at home to determine whether the stool contains blood.  Have you ever had this test using a home kit?,30,,,"7, 9",OHA_BRFSS_2017_Data_Dictionary.xlsx,
BRFSS,2017,BLIND,"C8.23. Are you blind or do you have serious difficulty seeing, even when wearing glasses?",31,,,"7, 9",OHA_BRFSS_2017_Data_Dictionary.xlsx,
BRFSS,2017,BPHIGH4,"C4.1. Have you EVER been told by a doctor, nurse, or other health professional that you have high blood pressure?",32,,,"7, 9",OHA_BRFSS_2017_Data_Dictionary.xlsx,
BRFSS,2017,BPMEDS,C4.2. Are you currently taking medicine for your high blood pressure?,33,,,"7, 9",OHA_BRFSS_2017_Data_Dictionary.xlsx,
BRFSS,2017,BRCOUNSEL,OR85.2. Have you or any of your family members received genetic counseling for breast and ovarian cancer?,34,,,"7, 9",OHA_BRFSS_2017_Data_Dictionary.xlsx,
BRFSS,2017,BRFIRSTAGE,OR85.5. At what age were you first told that you had cancer?,35,,,"997, 999",OHA_BRFSS_2017_Data_Dictionary.xlsx,
BRFSS,2017,BROVDIAG,OR85.4. Have you ever been diagnosed with breast or ovarian cancer?,36,,,"7, 9",OHA_BRFSS_2017_Data_Dictionary.xlsx,
BRFSS,2017,BRRELAGE45,OR85.8. And how many of these relatives were diagnosed with breast cancer at or before the age of 45 years?,37,,,"7, 9",OHA_BRFSS_2017_Data_Dictionary.xlsx,
BRFSS,2017,BRRELAGE50,OR85.7. How many of these relatives were diagnosed with breast cancer at or before the age of 50 years?,38,,,"7, 9",OHA_BRFSS_2017_Data_Dictionary.xlsx,
BRFSS,2017,BRRELNUM,"OR85.6. Thinking about your biological or 'blood' relatives, including your parents, grandparents, siblings, aunts, uncles, children or grandchildren, how many of these relatives have been diagnosed with breast cancer?",39,,,"7, 9",OHA_BRFSS_2017_Data_Dictionary.xlsx,
BRFSS,2017,BRTEST,OR85.3. Have you or any of your family members EVER HAD a blood test for the B-R-C-A gene to determine if you or they are at increased risk of developing breast or ovarian cancer?,40,,,"7, 9",OHA_BRFSS_2017_Data_Dictionary.xlsx,
BRFSS,2017,CADULT,S3. [CDC] Are you 18 years of age or older?,41,,,"7, 9",OHA_BRFSS_2017_Data_Dictionary.xlsx,
BRFSS,2017,CALLBACK,OR91.1. Would it be okay if we called you back to ask additional asthma-related questions at a later time?,42,,,"7, 9",OHA_BRFSS_2017_Data_Dictionary.xlsx,
BRFSS,2017,CANCERTYPE,"OR106.3. With your most recent diagnosis of [q165]##, what type of [Q165]## was it?",43,,,"77, 99",OHA_BRFSS_2017_Data_Dictionary.xlsx,
BRFSS,2017,CANCERTYPEO,Enter Other Or106.3,44,,,,OHA_BRFSS_2017_Data_Dictionary.xlsx,no value labels in Variables sheet or Values sheet
BRFSS,2017,CAREAGE,OR143.1. What age is the person to whom you are giving care?,45,,,"777, 999",OHA_BRFSS_2017_Data_Dictionary.xlsx,
BRFSS,2017,CAREGIV1,"M21.1. During the past 30 days, did you provide regular care or assistance to a friend or family member who has a health problem or disability?",46,,,"7, 9",OHA_BRFSS_2017_Data_Dictionary.xlsx,
BRFSS,2017,CAREQUITX,OR143.2. Did you leave full-time employment to provide care for this person?,47,,,"7, 9",OHA_BRFSS_2017_Data_Dictionary.xlsx,
BRFSS,2017,CARESUPP,"OR143.3. Is there some OTHER KIND OF HELP that you NEED for providing care to this person, but are currently not getting?",48,,,"7, 9",OHA_BRFSS_2017_Data_Dictionary.xlsx,
BRFSS,2017,CARESUPP2,"OR143.4. Considering these and other kinds of help for caregivers, which is the next most needed support service that you are currently not getting?",49,,,"7, 9",OHA_BRFSS_2017_Data_Dictionary.xlsx,
BRFSS,2017,CARESUPP2O,Enter Other Service OR143.4.,50,,,,OHA_BRFSS_2017_Data_Dictionary.xlsx,no value labels in Variables sheet or Values sheet
BRFSS,2017,CARESUPPO,Enter Other Service OR143.3.,51,,,,OHA_BRFSS_2017_Data_Dictionary.xlsx,no value labels in Variables sheet or Values sheet
BRFSS,2017,CARETRAINALZ,"OR143.5. In the past 12 months, have you received online training or other individual or group training about providing care for someone with Alzheimer's or other dementias?",52,,,"7, 9",OHA_BRFSS_2017_Data_Dictionary.xlsx,
BRFSS,2017,CASTHDX2,"M29.1. Has a doctor, nurse, or other health professional EVER said that the child has asthma?",53,,,"7, 9",OHA_BRFSS_2017_Data_Dictionary.xlsx,
BRFSS,2017,CASTHNO2,M29.2. Does the child still have asthma?,54,,,"7, 9",OHA_BRFSS_2017_Data_Dictionary.xlsx,
BRFSS,2017,CCLGHOUS,"C4B. [CDC] Do you live in college housing? By college housing, we mean dormitory, graduate student or visiting faculty housing, or other housing arrangement provided by a college or university.",55,,,"77, 99",OHA_BRFSS_2017_Data_Dictionary.xlsx,
BRFSS,2017,CDASSIST,"M22.3. As a result of confusion or memory loss, how often do you need assistance with these day-to-day activities?",56,,,"7, 9",OHA_BRFSS_2017_Data_Dictionary.xlsx,
BRFSS,2017,CDDISCUS,M22.6. Have you or anyone else discussed your confusion or memory loss with a health care professional?,57,,,"7, 9",OHA_BRFSS_2017_Data_Dictionary.xlsx,
BRFSS,2017,CDHELP,"M22.4 When you need help with these day-to-day activities, how often are you able to get the help that you need?",58,,,"7, 9",OHA_BRFSS_2017_Data_Dictionary.xlsx,
BRFSS,2017,CDHOUSE,"M22.2. During the past 12 months, how often have you given up day-to-day household activities or chores you used to do, such as cooking, cleaning, taking medications, driving, or paying bills?",59,,,"7, 9",OHA_BRFSS_2017_Data_Dictionary.xlsx,
BRFSS,2017,CDSOCIAL,"M22.5. During the past 12 months, how often has confusion or memory loss interfered with your ability to work, volunteer, or engage in social activities outside the home?",60,,,"7, 9",OHA_BRFSS_2017_Data_Dictionary.xlsx,
BRFSS,2017,CELLDRIVE,SA. I need to make sure that you are not driving while we talk.  Are you on a cell phone and driving?,61,,,,OHA_BRFSS_2017_Data_Dictionary.xlsx,
BRFSS,2017,CELLFON4,Is this a cell telephone?,62,,,,OHA_BRFSS_2017_Data_Dictionary.xlsx,
BRFSS,2017,CELLFON5,S2. [CDC] Is this a cell telephone? By cell telephone we mean a telephone that is mobile and usable outside of your neighborhood.,63,,,"7, 9",OHA_BRFSS_2017_Data_Dictionary.xlsx,
BRFSS,2017,CELLPERCENT,"S8. Thinking about all the phone calls that you receive on your landline and cell phone, what percent, between 0 and 100, are received on your cell phone?",64,,,,OHA_BRFSS_2017_Data_Dictionary.xlsx,no value labels in Variables sheet or Values sheet
BRFSS,2017,CHCCOPD1,"C6.8. Ever told you have Chronic Obstructive Pulmonary Disease (COPD), emphysema or chronic bronchitis?",65,,,"7, 9",OHA_BRFSS_2017_Data_Dictionary.xlsx,
BRFSS,2017,CHCKIDNY,"C6.11. (Ever told) you have kidney disease?  Do NOT include kidney stones, bladder infection or incontinence.",66,,,"7, 9",OHA_BRFSS_2017_Data_Dictionary.xlsx,
BRFSS,2017,CHCOCNCR,C6.7. (Ever told) you had any other types of cancer?,67,,,"7, 9",OHA_BRFSS_2017_Data_Dictionary.xlsx,
BRFSS,2017,CHCSCNCR,C6.6. (Ever told) you had skin cancer?,68,,,"7, 9",OHA_BRFSS_2017_Data_Dictionary.xlsx,
BRFSS,2017,CHECKUP1,"C3.4. A routine checkup is a general physical exam, not an exam for a specific injury, illness, or condition.  About how long has it been since you last visited a doctor for a routine checkup?",69,,,"7, 9",OHA_BRFSS_2017_Data_Dictionary.xlsx,
BRFSS,2017,CHILDAGE1,Child's age reported in months (total months),70,,,,OHA_BRFSS_2017_Data_Dictionary.xlsx,no value labels in Variables sheet or Values sheet
BRFSS,2017,CHILDAGE2,Child's age reported years: (Total months/12),71,,,,OHA_BRFSS_2017_Data_Dictionary.xlsx,no value labels in Variables sheet or Values sheet
BRFSS,2017,CHILDREN,C8.16. How many children less than 18 years of age live in your household?,72,,,"88, 99",OHA_BRFSS_2017_Data_Dictionary.xlsx,
BRFSS,2017,CHOLCHK1,C5.1. Blood cholesterol is a fatty substance found in the blood.  About how long has it been since you last had your blood cholesterol checked?,73,,,"7, 9",OHA_BRFSS_2017_Data_Dictionary.xlsx,
BRFSS,2017,CHOLMED1,C5.3. Are you currently taking medicine prescribed by a doctor or other health professional for your blood cholesterol?,74,,,"7, 9",OHA_BRFSS_2017_Data_Dictionary.xlsx,
BRFSS,2017,CIGARLARGE,"OR31.1. Have you smoked a full-sized cigar in the last month? Examples would be Dutch Master, White Owl, King Edward, or Muriel.",75,,,"7, 9",OHA_BRFSS_2017_Data_Dictionary.xlsx,
BRFSS,2017,CIGARSMALL,"OR31.2. Have you smoked a smaller-sized cigar or a cigarillo in the last month?  Examples would be Swisher Sweets, Cheyenne, or Winchester.",76,,,"7, 9",OHA_BRFSS_2017_Data_Dictionary.xlsx,
BRFSS,2017,CIMEMLOS,"M22.1. During the past 12 months, have you experienced confusion or memory loss that is happening more often or is getting worse?",77,,,"7, 9",OHA_BRFSS_2017_Data_Dictionary.xlsx,
BRFSS,2017,COLGHOUS,Do you live in college housing?,78,,,,OHA_BRFSS_2017_Data_Dictionary.xlsx,
BRFSS,2017,CONF_ADULT,S3. Are you 18 years of age or older?,79,,,,OHA_BRFSS_2017_Data_Dictionary.xlsx,
BRFSS,2017,CONF_CELL,S2. Is this a cell telephone? By cell telephone we mean a telephone that is mobile and usable outside of your neighborhood.,80,,,,OHA_BRFSS_2017_Data_Dictionary.xlsx,
BRFSS,2017,CONF_PHN,Is this (PHONE NUMBER)?,81,,,,OHA_BRFSS_2017_Data_Dictionary.xlsx,
BRFSS,2017,CONFCOLLEGE,"C4B. Do you live in college housing? By college housing, we mean dormitory, graduate student or visiting faculty housing, or other housing arrangement provided by a college or university.",82,,,,OHA_BRFSS_2017_Data_Dictionary.xlsx,
BRFSS,2017,CONFRES,"C4A. Do you live in a private residence?  By private residence, we mean someplace like a house or apartment.",83,,,,OHA_BRFSS_2017_Data_Dictionary.xlsx,
BRFSS,2017,COSTOOLTB2,"OR117.2. I just need to clarify a detail about the answer you just gave - was the stool test you were just referring to test at home using a special kit, or did it happen in a medical setting such as a doctor's office?",84,,,"7, 9",OHA_BRFSS_2017_Data_Dictionary.xlsx,
BRFSS,2017,COUPONGET,"OR111.1. In the last 30 days, did you receive tobacco coupons or other discounts in the mail, over the Internet, or from any other source?",85,,,"7, 9",OHA_BRFSS_2017_Data_Dictionary.xlsx,
BRFSS,2017,COUPONUSE,"OR111.2. In the last 30 days, did you buy any tobacco product using coupons, rebates, buy 1 get 1 free, or any other special promotions?",86,,,"7, 9",OHA_BRFSS_2017_Data_Dictionary.xlsx,
BRFSS,2017,CPDEMO4,"C8.13A. Thinking about all the phone calls that you receive on your landline and cell phone, what percent, between 0 and 100, are received on your cell phone?",87,,,"777, 999",OHA_BRFSS_2017_Data_Dictionary.xlsx,
BRFSS,2017,CPDEMO1A,"C8.13. Including the phones for business and personal use, do you have a cell phone for personal use?",88,,,"7, 9",OHA_BRFSS_2017_Data_Dictionary.xlsx,
BRFSS,2017,CRGVEXPT,"M21.9. In the next 2 years, do you expect to provide care or assistance to a friend or family member who has a health problem or disability?",89,,,"7, 9",OHA_BRFSS_2017_Data_Dictionary.xlsx,
BRFSS,2017,CRGVHOUS,"M21.7. In the past 30 days, did you provide care for this person by managing household tasks such as cleaning, managing money, or preparing meals?",90,,,"7, 9",OHA_BRFSS_2017_Data_Dictionary.xlsx,
BRFSS,2017,CRGVHRS1,"M21.4. In an average week, how many hours do you provide care or assistance? Would you say...",91,,,"7, 9",OHA_BRFSS_2017_Data_Dictionary.xlsx,
BRFSS,2017,CRGVLNG1,M21.3. For how long have you provided care for that person?  Would you say...,92,,,"7, 9",OHA_BRFSS_2017_Data_Dictionary.xlsx,
BRFSS,2017,CRGVMST2,"M21.8. Of the following support services, which one do YOU most need, that you are not currently getting?",93,,,"7, 9",OHA_BRFSS_2017_Data_Dictionary.xlsx,
BRFSS,2017,CRGVPERS,"M21.6. In the past 30 days, did you provide care for this person by managing personal care such as giving medications, feeding, dressing, or bathing?",94,,,"7, 9",OHA_BRFSS_2017_Data_Dictionary.xlsx,
BRFSS,2017,CRGVPRB2,"M21.5. What is the main health problem, long-term illness, or disability that the person you care for has? IF NECESSARY/MORE THAN ONE MENTIONED: Please tell me which one of these conditions would you say is the MAJOR problem?",95,,,"77, 99",OHA_BRFSS_2017_Data_Dictionary.xlsx,
BRFSS,2017,CRGVREL2,M21.2 What is his or her relationship to you?  For example is he or she your (mother or daughter or father or son)?,96,,,"77, 99",OHA_BRFSS_2017_Data_Dictionary.xlsx,
BRFSS,2017,CSHISPX1,"M28.3. Is the child Hispanic, __, or Spanish origin? (IF YES, ASK:  Is the child... Mexican, Mexican American, __ Puerto Rican Cuban Mixteco or Mayan Another Hispanic, __, or Spanish origin?",97,,,,OHA_BRFSS_2017_Data_Dictionary.xlsx,
BRFSS,2017,CSHISPX2,"M28.3. Is the child Hispanic, __, or Spanish origin? (IF YES, ASK:  Is the child... Mexican, Mexican American, __ Puerto Rican Cuban Mixteco or Mayan Another Hispanic, __, or Spanish origin?",98,,,,OHA_BRFSS_2017_Data_Dictionary.xlsx,
BRFSS,2017,CSHISPX3,"M28.3. Is the child Hispanic, __, or Spanish origin? (IF YES, ASK:  Is the child... Mexican, Mexican American, __ Puerto Rican Cuban Mixteco or Mayan Another Hispanic, __, or Spanish origin?",99,,,,OHA_BRFSS_2017_Data_Dictionary.xlsx,
BRFSS,2017,CSHISPX4,"M28.3. Is the child Hispanic, __, or Spanish origin? (IF YES, ASK:  Is the child... Mexican, Mexican American, __ Puerto Rican Cuban Mixteco or Mayan Another Hispanic, __, or Spanish origin?",100,,,,OHA_BRFSS_2017_Data_Dictionary.xlsx,
BRFSS,2017,CSHISPX5,"M28.3. Is the child Hispanic, __, or Spanish origin? (IF YES, ASK:  Is the child... Mexican, Mexican American, __ Puerto Rican Cuban Mixteco or Mayan Another Hispanic, __, or Spanish origin?",101,,,,OHA_BRFSS_2017_Data_Dictionary.xlsx,
BRFSS,2017,CSRACEAO,Enter Other M28.4.,102,,,,OHA_BRFSS_2017_Data_Dictionary.xlsx,no value labels in Variables sheet or Values sheet
BRFSS,2017,CSRACEBO,Enter Other M28.4.,103,,,,OHA_BRFSS_2017_Data_Dictionary.xlsx,no value labels in Variables sheet or Values sheet
BRFSS,2017,CSRACECO,Enter Other M28.4.,104,,,,OHA_BRFSS_2017_Data_Dictionary.xlsx,no value labels in Variables sheet or Values sheet
BRFSS,2017,CSRACEDO,Enter Other M28.4.,105,,,,OHA_BRFSS_2017_Data_Dictionary.xlsx,no value labels in Variables sheet or Values sheet
BRFSS,2017,CSRACEEO,Enter Other M28.4.,106,,,,OHA_BRFSS_2017_Data_Dictionary.xlsx,no value labels in Variables sheet or Values sheet
