survey,year,raw_var_name,question_text,position,var_kind,module,missing_values_raw,source_file,parse_notes
BRFSS,2020,educag47,Highest Grade of Education Completed: Combines EDUCA and EDUCAX,300,,,9,OHA_BRFSS_2020_Data_Dictionary.xlsx,
BRFSS,2020,incomg,Annual Household Income,301,,,9,OHA_BRFSS_2020_Data_Dictionary.xlsx,
BRFSS,2020,disab5,,302,,,,OHA_BRFSS_2020_Data_Dictionary.xlsx,no value labels in Variables sheet or Values sheet
BRFSS,2020,disab6,,303,,,,OHA_BRFSS_2020_Data_Dictionary.xlsx,no value labels in Variables sheet or Values sheet
BRFSS,2020,hcvu65,Respondents ages 18-64 who have or do not have health care coverage,304,,,9,OHA_BRFSS_2020_Data_Dictionary.xlsx,
BRFSS,2020,ill30d2,Recode of ill30d which asks about status of physical health,305,,,99,OHA_BRFSS_2020_Data_Dictionary.xlsx,
BRFSS,2020,ment30d2,Recode of ment30d which asks about status of mental health,306,,,99,OHA_BRFSS_2020_Data_Dictionary.xlsx,
BRFSS,2020,incap30d_r,Recode of INCAP30D to include all 0's: days in  the past 30 in which  poor physical or mental health limited usual activities,307,,,,OHA_BRFSS_2020_Data_Dictionary.xlsx,no value labels in Variables sheet or Values sheet
BRFSS,2020,inca30d3,Recode of incap30d which asks about effect of physical or mental health upon daily activities,308,,,99,OHA_BRFSS_2020_Data_Dictionary.xlsx,
BRFSS,2020,rfhlth,Risk Factor: Adults with good or better health,309,,,9,OHA_BRFSS_2020_Data_Dictionary.xlsx,
BRFSS,2020,MJANY_Cat,MJANY: Catagories for web tables,310,,,,OHA_BRFSS_2020_Data_Dictionary.xlsx,no value labels in Variables sheet or Values sheet
BRFSS,2020,MJ30X2_Cat,MJ30X2: Catagories for web tables,311,,,,OHA_BRFSS_2020_Data_Dictionary.xlsx,no value labels in Variables sheet or Values sheet
BRFSS,2020,mjever,CALC: Ever used marijuana in any form,312,,,,OHA_BRFSS_2020_Data_Dictionary.xlsx,no value labels in Variables sheet or Values sheet
BRFSS,2020,mjcurrent,CALC: Current Marijuana use (past 30 days),313,,,,OHA_BRFSS_2020_Data_Dictionary.xlsx,no value labels in Variables sheet or Values sheet
BRFSS,2020,exteeth,Have had no permanent teeth removed,314,,,"7, 9",OHA_BRFSS_2020_Data_Dictionary.xlsx,
BRFSS,2020,alteeth,Adults aged 65+ who have had all their natural teeth extracted,315,,,"7, 9",OHA_BRFSS_2020_Data_Dictionary.xlsx,
BRFSS,2020,hisp,Hispanic,316,,,,OHA_BRFSS_2020_Data_Dictionary.xlsx,no value labels in Variables sheet or Values sheet
BRFSS,2020,white,White,317,,,,OHA_BRFSS_2020_Data_Dictionary.xlsx,no value labels in Variables sheet or Values sheet
BRFSS,2020,black,Black,318,,,,OHA_BRFSS_2020_Data_Dictionary.xlsx,no value labels in Variables sheet or Values sheet
BRFSS,2020,AmInd,American Indian or Alaska Native,319,,,,OHA_BRFSS_2020_Data_Dictionary.xlsx,no value labels in Variables sheet or Values sheet
BRFSS,2020,Asian,Asian,320,,,,OHA_BRFSS_2020_Data_Dictionary.xlsx,no value labels in Variables sheet or Values sheet
BRFSS,2020,NHawPI,Pacific Islander,321,,,,OHA_BRFSS_2020_Data_Dictionary.xlsx,no value labels in Variables sheet or Values sheet
BRFSS,2020,OthrRace,Other Race,322,,,,OHA_BRFSS_2020_Data_Dictionary.xlsx,no value labels in Variables sheet or Values sheet
BRFSS,2020,othrMRACE,<none>,323,,,,OHA_BRFSS_2020_Data_Dictionary.xlsx,no value labels in Variables sheet or Values sheet
BRFSS,2020,hisp_ct,<none>,324,,,,OHA_BRFSS_2020_Data_Dictionary.xlsx,no value labels in Variables sheet or Values sheet
BRFSS,2020,multrcnt,Multiple Mentions of Race-incl hisp preceding race,325,,,,OHA_BRFSS_2020_Data_Dictionary.xlsx,no value labels in Variables sheet or Values sheet
BRFSS,2020,multrcnt_RO,Multiple Mentions of Race (w/o hisp),326,,,,OHA_BRFSS_2020_Data_Dictionary.xlsx,no value labels in Variables sheet or Values sheet
BRFSS,2020,surveycore,Survey Versions in CDC Core data,327,,,,OHA_BRFSS_2020_Data_Dictionary.xlsx,no value labels in Variables sheet or Values sheet
BRFSS,2020,RACETHX_EXP2,"NEW Expanded Race-Ethnicity Detailed Recode, from MRACE1 & ORACE3X with added info from HISP",328,,,"77, 99, 999",OHA_BRFSS_2020_Data_Dictionary.xlsx,
BRFSS,2020,xrace_exp2,<none>,329,,,"77, 99, 999",OHA_BRFSS_2020_Data_Dictionary.xlsx,
BRFSS,2020,XRACETH_EXP,"Expanded Race-Ethnicity Detailed Recode, from MRACE1 & ORACE3X with HISP (precedence over race)",330,,,"77, 99, 999",OHA_BRFSS_2020_Data_Dictionary.xlsx,
BRFSS,2020,xraceth,"Race-Ethnicity Reporting Recode, from MRACE1 & ORACE3X with HISP (precedence over race)",331,,,"99, 999",OHA_BRFSS_2020_Data_Dictionary.xlsx,
BRFSS,2020,RACETHX2,"NEW Race-Ethnicity Reporting Recode, from MRACE1 & ORACE3X with added info from HISP",332,,,"99, 999",OHA_BRFSS_2020_Data_Dictionary.xlsx,
BRFSS,2020,URF,,333,,,,OHA_BRFSS_2020_Data_Dictionary.xlsx,no value labels in Variables sheet or Values sheet
BRFSS,2020,smoker2,Computed Smoking Status - CDC,334,,,9,OHA_BRFSS_2020_Data_Dictionary.xlsx,
BRFSS,2020,rfsmok2,Risk factor: Respondents that reported having smoked at least 100 cigarettes in their lifetime and currently SMOKDAY2 - CDC,335,,,9,OHA_BRFSS_2020_Data_Dictionary.xlsx,
BRFSS,2020,wtrk_cdc_core,CDC Core weight: Use to match CDC estimates,336,,,,OHA_BRFSS_2020_Data_Dictionary.xlsx,no value labels in Variables sheet or Values sheet
BRFSS,2020,wtrk_cdc_child,CDC Child weight: Use for child asthma estimates,337,,,,OHA_BRFSS_2020_Data_Dictionary.xlsx,no value labels in Variables sheet or Values sheet
BRFSS,2020,region_2016,Regions used in 2017 weighting; could use for reporting,338,,,99,OHA_BRFSS_2020_Data_Dictionary.xlsx,
BRFSS,2020,wtrk_all,Raked weight for State and Regional estimates,339,,,,OHA_BRFSS_2020_Data_Dictionary.xlsx,no value labels in Variables sheet or Values sheet
BRFSS,2021,ACEADNED,"M21.13 For how much of your childhood was there an adult in your household who tried hard to make sure your basic needs were met? Would you say never, a little of the time, some of the time, most of the time, or all of the time?",1,,,"6, 7, 9",OHA_BRFSS_2021_Data_Dictionary.xlsx,
BRFSS,2021,ACEADSAF,"M21.12 For how much of your childhood was there an adult in your household who made you feel safe and protected? Would you say never, a little of the time, some of the time, most of the time, or all of the time?",2,,,"6, 7, 9",OHA_BRFSS_2021_Data_Dictionary.xlsx,
BRFSS,2021,ACEDEPRS,"M21.01 Did you live with anyone who was depressed, mentally ill, or suicidal?",3,,,"6, 7, 9",OHA_BRFSS_2021_Data_Dictionary.xlsx,
BRFSS,2021,ACEDIVRC,M21.05 Were your parents separated or divorced?,4,,,"6, 7, 9",OHA_BRFSS_2021_Data_Dictionary.xlsx,
BRFSS,2021,ACEDRINK,M21.02 Did you live with anyone who was a problem drinker or alcoholic?,5,,,"6, 7, 9",OHA_BRFSS_2021_Data_Dictionary.xlsx,
BRFSS,2021,ACEDRUGS,M21.03 Did you live with anyone who used illegal street drugs or who abused prescription medications?,6,,,"6, 7, 9",OHA_BRFSS_2021_Data_Dictionary.xlsx,
BRFSS,2021,ACEHURT1,"M21.07 Not including spanking (before age 18), how often did a parent or adult in your home ever hit, beat, kick, or physically hurt you in any way? Was it... (PLEASE READ)",7,,,"6, 7, 9",OHA_BRFSS_2021_Data_Dictionary.xlsx,
BRFSS,2021,ACEHVSEX,"M21.11 How often did anyone at least 5 years older than you or an adult, force you to have sex? Was it... (PLEASE READ)",8,,,"6, 7, 9",OHA_BRFSS_2021_Data_Dictionary.xlsx,
BRFSS,2021,ACEPRISN,"M21.04 Did you live with anyone who served time or was sentenced to serve time in a prison, jail, or other correctional facility?",9,,,"6, 7, 9",OHA_BRFSS_2021_Data_Dictionary.xlsx,
BRFSS,2021,ACEPUNCH,"M21.06 How often did your parents or adults in your home ever slap, hit, kick, punch or beat each other up? Was it... (PLEASE READ)",10,,,"6, 7, 9",OHA_BRFSS_2021_Data_Dictionary.xlsx,
BRFSS,2021,ACESWEAR,"M21.08 How often did a parent or adult in your home ever swear at you, insult you, or put you down? Was it... (PLEASE READ)",11,,,"6, 7, 9",OHA_BRFSS_2021_Data_Dictionary.xlsx,
BRFSS,2021,ACETOUCH,"M21.09 How often did anyone at least 5 years older than you or an adult, ever touch you sexually? Was it... (PLEASE READ)",12,,,"6, 7, 9",OHA_BRFSS_2021_Data_Dictionary.xlsx,
BRFSS,2021,ACETTHEM,"M21.10 How often did anyone at least 5 years older than you or an adult, try to make you touch them sexually? Was it... (PLEASE READ)",13,,,"6, 7, 9",OHA_BRFSS_2021_Data_Dictionary.xlsx,
BRFSS,2021,ADDEPEV3,"C07.09 (Ever told) (you had) a depressive disorder (including depression, major depression, dysthymia, or minor depression)?",14,,,"7, 9",OHA_BRFSS_2021_Data_Dictionary.xlsx,
BRFSS,2021,ADHISPA,OR91.02 Adult Hispanic response,15,,,"7, 9",OHA_BRFSS_2021_Data_Dictionary.xlsx,
BRFSS,2021,AGE,C09.01 What is your age?,16,,,"7, 9",OHA_BRFSS_2021_Data_Dictionary.xlsx,
BRFSS,2021,AGEGRPX,C09.01C In which of these age categories do you belong?,17,,,"77, 99",OHA_BRFSS_2021_Data_Dictionary.xlsx,
BRFSS,2021,ALCDAY5,"C12.01 During the past 30 days, how many days per week or per month did you have at least one drink of any alcoholic beverage such as beer, wine, a malt beverage or liquor?",18,,,"777, 999",OHA_BRFSS_2021_Data_Dictionary.xlsx,
BRFSS,2021,ARTHDIS2,"C08.05. In the next question, we are referring to work for pay. Do arthritis or joint symptoms now affect whether you work, the type of work you do or the amount of work you do? amount of work)",19,,,"7, 9",OHA_BRFSS_2021_Data_Dictionary.xlsx,
BRFSS,2021,ARTHEDU,C08.03. Have you ever taken an educational course or class to teach you how to manage problems related to your arthritis or joint symptoms?,20,,,"7, 9",OHA_BRFSS_2021_Data_Dictionary.xlsx,
BRFSS,2021,ARTHEXER,C08.02. Has a doctor or other health professional ever suggested physical activity or exercise to help your arthritis or joint symptoms?,21,,,"7, 9",OHA_BRFSS_2021_Data_Dictionary.xlsx,
BRFSS,2021,ASTHMA3,C07.04 (Ever told) you had asthma?,22,,,"7, 9",OHA_BRFSS_2021_Data_Dictionary.xlsx,
BRFSS,2021,ASTHNOW,C07.05 Do you still have asthma?,23,,,"7, 9",OHA_BRFSS_2021_Data_Dictionary.xlsx,
BRFSS,2021,AVEDRNK3,"C12.02 One drink is equivalent to a 12-ounce beer, a 5-ounce glass of wine, or a drink with one shot of liquor. During the past 30 days, on the days when you drank, about how many drinks did you drink on the average?",24,,,"77, 99",OHA_BRFSS_2021_Data_Dictionary.xlsx,no value labels in Variables sheet or Values sheet
BRFSS,2021,BLDSTFIT,M12.12 Was the blood stool or FIT (you reported earlier) conducted as part of a Cologuard test?,25,,,"7, 9",OHA_BRFSS_2021_Data_Dictionary.xlsx,
BRFSS,2021,BLIND,"C10.02 Are you blind or do you have serious difficulty seeing, even when wearing glasses?",26,,,"7, 9",OHA_BRFSS_2021_Data_Dictionary.xlsx,
BRFSS,2021,BPHIGH6,"C05.01 Have you ever been told by a doctor, nurse, or other health professional that you have high blood pressure?",27,,,"7, 9",OHA_BRFSS_2021_Data_Dictionary.xlsx,
BRFSS,2021,BPMEDS,C05.02 Are you currently taking prescription medicine for your high blood pressure?,28,,,"7, 9",OHA_BRFSS_2021_Data_Dictionary.xlsx,
BRFSS,2021,CADULT1,[CDC] CP.04 Are you 18 years of age or older?,29,,,"7, 9",OHA_BRFSS_2021_Data_Dictionary.xlsx,
BRFSS,2021,CADULT1X,CP.04 Are you 18 years of age or older?,30,,,,OHA_BRFSS_2021_Data_Dictionary.xlsx,
BRFSS,2021,CALLBACK,OR91.01 We would like to call you again within the next 2 weeks to talk in more detail about (your/your child’s) experiences with asthma.,31,,,"7, 9",OHA_BRFSS_2021_Data_Dictionary.xlsx,
BRFSS,2021,CAREAGE,OR143.01 What age is the person to whom you are giving care?,32,,,"777, 999",OHA_BRFSS_2021_Data_Dictionary.xlsx,no value labels in Variables sheet or Values sheet
BRFSS,2021,CAREGIV1,"M19.01 During the past 30 days, did you provide regular care or assistance to a friend or family member who has a health problem or disability?",33,,,"7, 9",OHA_BRFSS_2021_Data_Dictionary.xlsx,
BRFSS,2021,CAREQUITX,OR143.2 Did you leave full-time employment to provide care for this person?,34,,,"7, 9",OHA_BRFSS_2021_Data_Dictionary.xlsx,
BRFSS,2021,CARETRAIN,"OR143.3 In relation to the care you are providing for this person, have you ever participated in online or in-person training about caregiving?",35,,,"7, 9",OHA_BRFSS_2021_Data_Dictionary.xlsx,
BRFSS,2021,CARETRAINALZ,"OR143.4 In relation to the care you are providing for this person, have you ever participated in online or in-person training about providing care for someone with Alzheimer's or other dementias?",36,,,"7, 9",OHA_BRFSS_2021_Data_Dictionary.xlsx,
BRFSS,2021,CCLGHOUS,[CDC] CP.07 Do you live in college housing?,37,,,"77, 99",OHA_BRFSS_2021_Data_Dictionary.xlsx,
BRFSS,2021,CCLGHOUSX,CP.07 Do you live in college housing?,38,,,"77, 99",OHA_BRFSS_2021_Data_Dictionary.xlsx,
BRFSS,2021,CDASSIST,"M18.03 As a result of confusion or memory loss, how often do you need assistance with these day-to-day activities?",39,,,"7, 9",OHA_BRFSS_2021_Data_Dictionary.xlsx,
BRFSS,2021,CDDISCUS,M18.06 Have you or anyone else discussed your confusion or memory loss with a health care professional?,40,,,"7, 9",OHA_BRFSS_2021_Data_Dictionary.xlsx,
BRFSS,2021,CDHELP,"M18.04 When you need help with these day-to-day activities, how often are you able to get the help that you need?",41,,,"7, 9",OHA_BRFSS_2021_Data_Dictionary.xlsx,
BRFSS,2021,CDHOUSE,"M18.02 During the past 12 months, as a result of confusion or memory loss, how often have you given up day-to-day household activities or chores you used to do, such as cooking, cleaning, taking medications, driving, or paying bills?",42,,,"7, 9",OHA_BRFSS_2021_Data_Dictionary.xlsx,
BRFSS,2021,CDSOCIAL,"M18.05 During the past 12 months, how often has confusion or memory loss interfered with your ability to work, volunteer, or engage in social activities outside the home?",43,,,"7, 9",OHA_BRFSS_2021_Data_Dictionary.xlsx,
BRFSS,2021,CELLFON5,[CDC] CP.03 Is this a cell phone?,44,,,"7, 9",OHA_BRFSS_2021_Data_Dictionary.xlsx,
BRFSS,2021,CELPHON1,LL.05 Is this a cell telephone?,45,,,,OHA_BRFSS_2021_Data_Dictionary.xlsx,
BRFSS,2021,CHCCOPD3,"C07.08 (Ever told) (you had) chronic obstructive pulmonary disease, C.O.P.D., emphysema or chronic bronchitis?",46,,,"7, 9",OHA_BRFSS_2021_Data_Dictionary.xlsx,
BRFSS,2021,CHCKDNY2,"C07.10 Not including kidney stones, bladder infection or incontinence, were you ever told you had kidney disease?",47,,,"7, 9",OHA_BRFSS_2021_Data_Dictionary.xlsx,
BRFSS,2021,CHCOCNCR,C07.07 (Ever told) you had any other types of cancer?,48,,,"7, 9",OHA_BRFSS_2021_Data_Dictionary.xlsx,
BRFSS,2021,CHCSCNCR,C07.06 (Ever told) you had skin cancer?,49,,,"7, 9",OHA_BRFSS_2021_Data_Dictionary.xlsx,
BRFSS,2021,CHECKUP1,C03.04 About how long has it been since you last visited a doctor for a routine checkup?,50,,,"7, 9",OHA_BRFSS_2021_Data_Dictionary.xlsx,
BRFSS,2021,CHHISPA,OR91.02 Child Hispanic response,51,,,"7, 9",OHA_BRFSS_2021_Data_Dictionary.xlsx,
BRFSS,2021,CHILDREN,C09.15 How many children less than 18 years of age live in your household?,52,,,"88, 99",OHA_BRFSS_2021_Data_Dictionary.xlsx,
BRFSS,2021,CHOLCHK3,C06.01 Cholesterol is a fatty substance found in the blood. About how long has it been since you last had your cholesterol checked?,53,,,"7, 9",OHA_BRFSS_2021_Data_Dictionary.xlsx,
BRFSS,2021,CHOLMED3,C06.03 Are you currently taking medicine prescribed by your doctor or other health professional for your cholesterol?,54,,,"7, 9",OHA_BRFSS_2021_Data_Dictionary.xlsx,
BRFSS,2021,CIGARLARGE,"OR31.1 Have you smoked a full-sized cigar in the last month? Examples would be Dutch Master, White Owl, King Edward, or Muriel.",55,,,"7, 9",OHA_BRFSS_2021_Data_Dictionary.xlsx,
BRFSS,2021,CIGARSMALL,"OR31.2 Have you smoked a smaller-sized cigar or a cigarillo in the  last month? Examples would be Swisher Sweets, Cheyenne, or Winchester.",56,,,"7, 9",OHA_BRFSS_2021_Data_Dictionary.xlsx,
BRFSS,2021,CIMEMLOS,"M18.01 During the past 12 months, have you experienced confusion or memory loss that is happening more often or is getting worse?",57,,,"7, 9",OHA_BRFSS_2021_Data_Dictionary.xlsx,
BRFSS,2021,COLGHOUS,LL.03 Do you live in college housing?,58,,,"77, 99",OHA_BRFSS_2021_Data_Dictionary.xlsx,
BRFSS,2021,COLNCNCR,"M12.06 Have you ever had any other kind of test for colorectal cancer, such as virtual colonoscopy, CT colonography, blood stool test, FIT DNA, or Cologuard test?",59,,,"7, 9",OHA_BRFSS_2021_Data_Dictionary.xlsx,
BRFSS,2021,COLNSIGM,"M12.02 Have you had a colonoscopy, a sigmoidoscopy, or both?",60,,,"7, 9",OHA_BRFSS_2021_Data_Dictionary.xlsx,
BRFSS,2021,COLNTES1,M12.03 How long has it been since your most recent colonoscopy?,61,,,"7, 9",OHA_BRFSS_2021_Data_Dictionary.xlsx,
BRFSS,2021,CONF_CELL,CP.03 Is this a cell phone?,62,,,"7, 9",OHA_BRFSS_2021_Data_Dictionary.xlsx,
BRFSS,2021,CPDEMO1B,C09.12 How many cell phones do you have for personal use?,63,,,"7, 9",OHA_BRFSS_2021_Data_Dictionary.xlsx,
BRFSS,2021,CRGVALZD,"M19.06 Does the person you care for also have Alzheimer’s disease, dementia or other cognitive impairment disorder?",64,,,"7, 9",OHA_BRFSS_2021_Data_Dictionary.xlsx,
BRFSS,2021,CRGVEXPT,"M19.09 In the next 2 years, do you expect to provide care or assistance to a friend or family member who has a health problem or disability?",65,,,"7, 9",OHA_BRFSS_2021_Data_Dictionary.xlsx,
BRFSS,2021,CRGVHOU1,"M19.08 In the past 30 days, did you provide care for this person by managing household tasks such as cleaning, managing money, or preparing meals?",66,,,"7, 9",OHA_BRFSS_2021_Data_Dictionary.xlsx,
BRFSS,2021,CRGVHRS1,"M19.04 In an average week, how many hours do you provide care or assistance?",67,,,"7, 9",OHA_BRFSS_2021_Data_Dictionary.xlsx,
BRFSS,2021,CRGVLNG1,M19.03 For how long have you provided care for that person?,68,,,"7, 9",OHA_BRFSS_2021_Data_Dictionary.xlsx,
BRFSS,2021,CRGVPER1,"M19.07 In the past 30 days, did you provide care for this person by managing personal care such as giving medications, feeding, dressing, or bathing?",69,,,"7, 9",OHA_BRFSS_2021_Data_Dictionary.xlsx,
BRFSS,2021,CRGVPRB3,"[CDC] M19.05 What is the main health problem, long-term illness, or disability that the person you care for has?",70,,,"77, 99",OHA_BRFSS_2021_Data_Dictionary.xlsx,
BRFSS,2021,CRGVPRB3X,"M19.05 What is the main health problem, long-term illness, or disability that the person you care for has?",71,,,"77, 99",OHA_BRFSS_2021_Data_Dictionary.xlsx,
BRFSS,2021,CRGVREL4,M19.02 What is his or her relationship to you?,72,,,"77, 99",OHA_BRFSS_2021_Data_Dictionary.xlsx,
BRFSS,2021,CSTATE1,CP.08 Do you currently live in,73,,,"7, 9",OHA_BRFSS_2021_Data_Dictionary.xlsx,
BRFSS,2021,CTELENM1,[CDC] LL.01 Is this     (phone number)     ?,74,,,,OHA_BRFSS_2021_Data_Dictionary.xlsx,
BRFSS,2021,CTELENUM1,LL.01 Is this     (phone number)     ?,75,,,,OHA_BRFSS_2021_Data_Dictionary.xlsx,
BRFSS,2021,CTELNUM1,[CDC] CP.02 Is this     (phone number)     ?,76,,,,OHA_BRFSS_2021_Data_Dictionary.xlsx,
BRFSS,2021,CTELNUM1X,CP.02 Is this     (phone number)     ?,77,,,"7, 9",OHA_BRFSS_2021_Data_Dictionary.xlsx,
BRFSS,2021,CVDCRHD4,C07.02 (Ever told) you had angina or coronary heart disease?,78,,,"7, 9",OHA_BRFSS_2021_Data_Dictionary.xlsx,
BRFSS,2021,CVDINFR4,"C07.01 (Ever told) you had a heart attack, also called a myocardial infarction?",79,,,"7, 9",OHA_BRFSS_2021_Data_Dictionary.xlsx,
BRFSS,2021,CVDSTRK3,C07.03 (Ever told) you had a stroke.,80,,,"7, 9",OHA_BRFSS_2021_Data_Dictionary.xlsx,
BRFSS,2021,DEAF,C10.01 Are you deaf or do you have serious difficulty hearing?,81,,,"7, 9",OHA_BRFSS_2021_Data_Dictionary.xlsx,
BRFSS,2021,DECIDE,"C10.03 Because of a physical, mental, or emotional condition, do you have serious difficulty concentrating, remembering, or making decisions?",82,,,"7, 9",OHA_BRFSS_2021_Data_Dictionary.xlsx,
BRFSS,2021,DENSTR2,Household Density Stratum,83,,,,OHA_BRFSS_2021_Data_Dictionary.xlsx,no value labels in Variables sheet or Values sheet
BRFSS,2021,DHISPALAX1,"C09.02 Are you Hispanic, Latino/a, or Spanish origin?",84,,,"7, 9",OHA_BRFSS_2021_Data_Dictionary.xlsx,
BRFSS,2021,DHISPALAX2,"C09.02 Are you Hispanic, Latino/a, or Spanish origin?",85,,,"7, 9",OHA_BRFSS_2021_Data_Dictionary.xlsx,
BRFSS,2021,DHISPALAX3,"C09.02 Are you Hispanic, Latino/a, or Spanish origin?",86,,,"7, 9",OHA_BRFSS_2021_Data_Dictionary.xlsx,
BRFSS,2021,DHISPALAX4,"C09.02 Are you Hispanic, Latino/a, or Spanish origin?",87,,,"7, 9",OHA_BRFSS_2021_Data_Dictionary.xlsx,
BRFSS,2021,DIABAGE3,C07.12 How old were you when you were told you had diabetes?,88,,,"98, 99",OHA_BRFSS_2021_Data_Dictionary.xlsx,
BRFSS,2021,DIABETE4,C07.11 (Ever told) (you had) diabetes?,89,,,"7, 9",OHA_BRFSS_2021_Data_Dictionary.xlsx,
BRFSS,2021,DIFFALON,"C10.06 Because of a physical, mental, or emotional condition, do you have difficulty doing errands alone such as visiting a doctor´s office or shopping?",90,,,"7, 9",OHA_BRFSS_2021_Data_Dictionary.xlsx,
BRFSS,2021,DIFFDRES,C10.05 Do you have difficulty dressing or bathing?,91,,,"7, 9",OHA_BRFSS_2021_Data_Dictionary.xlsx,
BRFSS,2021,DIFFWALK,C10.04 Do you have serious difficulty walking or climbing stairs?,92,,,"7, 9",OHA_BRFSS_2021_Data_Dictionary.xlsx,
BRFSS,2021,DISPCODE,Final Disposition,93,,,,OHA_BRFSS_2021_Data_Dictionary.xlsx,
BRFSS,2021,DM2LANG,OR01.02 Do you regularly speak a language other than English at Home?,94,,,"7, 9",OHA_BRFSS_2021_Data_Dictionary.xlsx,
BRFSS,2021,DM2LANGA,OR01.03 What is this language?,95,,,"77, 99",OHA_BRFSS_2021_Data_Dictionary.xlsx,
BRFSS,2021,DM2LANGB,OR01.03 What is this language?,96,,,"77, 99",OHA_BRFSS_2021_Data_Dictionary.xlsx,
BRFSS,2021,DM2LANGO,OR01.03 What is this language?,97,,,,OHA_BRFSS_2021_Data_Dictionary.xlsx,no value labels in Variables sheet or Values sheet
BRFSS,2021,DRNK3GE5,"C12.03 Considering all types of alcoholic beverages, how many times during the past 30 days did you have 5 or more drinks for men or 4 or more drinks for women on an occasion?",98,,,"77, 99",OHA_BRFSS_2021_Data_Dictionary.xlsx,
BRFSS,2021,ECIGARET,"OR134.01 Have you ever used an e-cigarette or other electronic vaping product, even just one time, in your entire life?",99,,,"7, 9",OHA_BRFSS_2021_Data_Dictionary.xlsx,
BRFSS,2021,ECIGNOW1,"[CDC] C11.04 Do you now use e-cigarettes or other electronic vaping products every day, some days, or not at all?",100,,,"7, 9",OHA_BRFSS_2021_Data_Dictionary.xlsx,
BRFSS,2021,ECIGNOWOR,"C11.04 Do you now use e-cigarettes or other electronic vaping products every day, some days, or not at all?",101,,,"7, 9",OHA_BRFSS_2021_Data_Dictionary.xlsx,
BRFSS,2021,EDUCA,Recode of EDUCAX to match CDC EDUCA,102,,,9,OHA_BRFSS_2021_Data_Dictionary.xlsx,
BRFSS,2021,EDUCAX,C09.06 What is the highest grade or year of school you completed?,103,,,9,OHA_BRFSS_2021_Data_Dictionary.xlsx,
BRFSS,2021,EMPLOY1,C09.14 Are you currently…?,104,,,9,OHA_BRFSS_2021_Data_Dictionary.xlsx,
BRFSS,2021,EXERANY2,"C04.01 During the past month, other than your regular job, did you participate in any physical activities or exercises such as running, calisthenics, golf, gardening, or walking for exercise?",105,,,"7, 9",OHA_BRFSS_2021_Data_Dictionary.xlsx,
BRFSS,2021,FAMCANCER,OR191.01. Has a healthcare provider ever specifically asked you about your family history of cancer?,106,,,"7, 9",OHA_BRFSS_2021_Data_Dictionary.xlsx,
BRFSS,2021,FLSHTMY3_MONTH,C13.02 During what month and year did you receive your most recent flu vaccine that was sprayed in your nose or flu shot injected into your arm?,107,,,"77, 99",OHA_BRFSS_2021_Data_Dictionary.xlsx,
BRFSS,2021,FLSHTMY3_YEAR,C13.02 During what month and year did you receive your most recent flu vaccine that was sprayed in your nose or flu shot injected into your arm?,108,,,"7777, 9999",OHA_BRFSS_2021_Data_Dictionary.xlsx,
BRFSS,2021,FLUSHOT7,"C13.01 During the past 12 months, have you had either flu vaccine that was sprayed in your nose or flu shot injected into your arm?",109,,,"7, 9",OHA_BRFSS_2021_Data_Dictionary.xlsx,
BRFSS,2021,FMONTH,File Month,110,,,,OHA_BRFSS_2021_Data_Dictionary.xlsx,no value labels in Variables sheet or Values sheet
BRFSS,2021,FRENCHF1,"C15.04 How often did you eat any kind of fried potatoes, including French fries, home fries, or hash browns?",111,,,"777, 999",OHA_BRFSS_2021_Data_Dictionary.xlsx,no value labels in Variables sheet or Values sheet
BRFSS,2021,FRUIT2,"C15.01 Not including juices, how often did you eat fruit? You can tell me times per day, times per week or times per month.",112,,,"777, 999",OHA_BRFSS_2021_Data_Dictionary.xlsx,no value labels in Variables sheet or Values sheet
BRFSS,2021,FRUITJU2,"C15.02 Not including fruit-flavored drinks or fruit juices with added sugar, how often did you drink 100% fruit juice such as apple or orange juice?",113,,,"777, 999",OHA_BRFSS_2021_Data_Dictionary.xlsx,no value labels in Variables sheet or Values sheet
BRFSS,2021,FVGREEN1,"C15.03 How often did you eat a green leafy or lettuce salad, with or without other vegetables?",114,,,"777, 999",OHA_BRFSS_2021_Data_Dictionary.xlsx,no value labels in Variables sheet or Values sheet
BRFSS,2021,GENHLTH,C01.01 Would you say that in general your health is:,115,,,"7, 9",OHA_BRFSS_2021_Data_Dictionary.xlsx,
BRFSS,2021,GEOSTR,GEOSTRATUM,116,,,,OHA_BRFSS_2021_Data_Dictionary.xlsx,no value labels in Variables sheet or Values sheet
BRFSS,2021,HADSIGM4,M12.01 Colonoscopy and sigmoidoscopy are exams to check for colon cancer. Have you ever had either of these exams?,117,,,"7, 9",OHA_BRFSS_2021_Data_Dictionary.xlsx,
BRFSS,2021,HAVARTH5,"C08.01 (Ever told) (you had) some form of arthritis, rheumatoid arthritis, gout, lupus, or fibromyalgia?",118,,,"7, 9",OHA_BRFSS_2021_Data_Dictionary.xlsx,
BRFSS,2021,HEIGHT3,C09.19 About how tall are you without shoes?,119,,,"777, 999",OHA_BRFSS_2021_Data_Dictionary.xlsx,
BRFSS,2021,HHADULT,"CP.11 How many members of your household, including yourself, are 18 years of age or older?",120,,,,OHA_BRFSS_2021_Data_Dictionary.xlsx,no value labels in Variables sheet or Values sheet
BRFSS,2021,HISPANC3_1,"[CDC] C09.02 Are you Hispanic, Latino/a, or Spanish origin?",121,,,"7, 9",OHA_BRFSS_2021_Data_Dictionary.xlsx,
