survey,year,raw_var_name,question_text,position,var_kind,module,missing_values_raw,source_file,parse_notes
BRFSS,2014,CSBYY,M17.1. What is the birth year of the Xth child?,,question,M17:  Random Child Selection,,OHA_BRFSS_2014_Data_Dictionary.xlsx,
BRFSS,2014,CHILDAGE1,Child's age reported in months (total months),,question,M17:  Random Child Selection,,OHA_BRFSS_2014_Data_Dictionary.xlsx,
BRFSS,2014,CHILDAGE2,Child's age reported years: (Total months/12),,question,M17:  Random Child Selection,,OHA_BRFSS_2014_Data_Dictionary.xlsx,
BRFSS,2014,CSGENDER,M17.2. Is the child a boy or girl?,,question,M17:  Random Child Selection,,OHA_BRFSS_2014_Data_Dictionary.xlsx,
BRFSS,2014,CSHISPX1,"M17.3. Is the child Hispanic, Latino/a or Spanish origin? (IF YES, ASK:  Is the child... Mexican, Mexican American,Chicano/a, Puerto Rican Cuban Mixteco or Mayan Another Hispanic,Latino/a, or Spanish origin",,question,M17:  Random Child Selection,,OHA_BRFSS_2014_Data_Dictionary.xlsx,
BRFSS,2014,CSHISPX2,"M17.3. Is the child Hispanic, Latino/a or Spanish origin? (IF YES, ASK:  Is the child... Mexican, Mexican American,Chicano/a, Puerto Rican Cuban Mixteco or Mayan Another Hispanic,Latino/a, or Spanish origin",,question,M17:  Random Child Selection,,OHA_BRFSS_2014_Data_Dictionary.xlsx,
BRFSS,2014,CSHISPX3,"M17.3. Is the child Hispanic, Latino/a or Spanish origin? (IF YES, ASK:  Is the child... Mexican, Mexican American,Chicano/a, Puerto Rican Cuban Mixteco or Mayan Another Hispanic,Latino/a, or Spanish origin",,question,M17:  Random Child Selection,,OHA_BRFSS_2014_Data_Dictionary.xlsx,
BRFSS,2014,CSHISPX4,"M17.3. Is the child Hispanic, Latino/a or Spanish origin? (IF YES, ASK:  Is the child... Mexican, Mexican American,Chicano/a, Puerto Rican Cuban Mixteco or Mayan Another Hispanic,Latino/a, or Spanish origin",,question,M17:  Random Child Selection,,OHA_BRFSS_2014_Data_Dictionary.xlsx,
BRFSS,2014,CSHISPX5,"M17.3. Is the child Hispanic, Latino/a or Spanish origin? (IF YES, ASK:  Is the child... Mexican, Mexican American,Chicano/a, Puerto Rican Cuban Mixteco or Mayan Another Hispanic,Latino/a, or Spanish origin",,question,M17:  Random Child Selection,,OHA_BRFSS_2014_Data_Dictionary.xlsx,
BRFSS,2014,CSRACEA,M17.4. Which one or more of the following would you say is the race of the child? (RECORD FIRST RESPONSE),,question,M17:  Random Child Selection,,OHA_BRFSS_2014_Data_Dictionary.xlsx,
BRFSS,2014,CSRACEB,M17.4. Which one or more of the following would you say is the race of the child? (RECORD SECOND RESPONSE),,question,M17:  Random Child Selection,,OHA_BRFSS_2014_Data_Dictionary.xlsx,
BRFSS,2014,CSRACEC,M17.4. Which one or more of the following would you say is the race of the child? (RECORD THIRD RESPONSE),,question,M17:  Random Child Selection,,OHA_BRFSS_2014_Data_Dictionary.xlsx,
BRFSS,2014,CSRACED,M17.4. Which one or more of the following would you say is the race of the child? (RECORD FOURTH RESPONSE),,question,M17:  Random Child Selection,,OHA_BRFSS_2014_Data_Dictionary.xlsx,
BRFSS,2014,CSRACEE,M17.4. Which one or more of the following would you say is the race of the child? (RECORD FIFTH RESPONSE),,question,M17:  Random Child Selection,,OHA_BRFSS_2014_Data_Dictionary.xlsx,
BRFSS,2014,CSRACEF,M17.4. Which one or more of the following would you say is the race of the child? (RECORD SIXTH RESPONSE),,question,M17:  Random Child Selection,,OHA_BRFSS_2014_Data_Dictionary.xlsx,
BRFSS,2014,CSRACEAO,Enter M17.4. Other Here:,,question,M17:  Random Child Selection,,OHA_BRFSS_2014_Data_Dictionary.xlsx,
BRFSS,2014,CSRACEBO,Enter M17.4. Other Here:,,question,M17:  Random Child Selection,,OHA_BRFSS_2014_Data_Dictionary.xlsx,
BRFSS,2014,CSRACECO,Enter M17.4. Other Here:,,question,M17:  Random Child Selection,,OHA_BRFSS_2014_Data_Dictionary.xlsx,
BRFSS,2014,CSRACEDO,Enter M17.4. Other Here:,,question,M17:  Random Child Selection,,OHA_BRFSS_2014_Data_Dictionary.xlsx,
BRFSS,2014,CSRACEEO,Enter M17.4. Other Here:,,question,M17:  Random Child Selection,,OHA_BRFSS_2014_Data_Dictionary.xlsx,
BRFSS,2014,CSRACEFO,Enter M17.4. Other Here:,,question,M17:  Random Child Selection,,OHA_BRFSS_2014_Data_Dictionary.xlsx,
BRFSS,2014,CSRACE1O,Enter M17.4. Other Here:,,question,M17:  Random Child Selection,,OHA_BRFSS_2014_Data_Dictionary.xlsx,duplicate variable name in source codebook (2 rows)
BRFSS,2014,CSRACE1,M17.5. Which ONE of these groups would you say best represents the child's race?,,question,M17:  Random Child Selection,,OHA_BRFSS_2014_Data_Dictionary.xlsx,
BRFSS,2014,CSRACE1O,Enter M17.5. Other Here:,,question,M17:  Random Child Selection,,OHA_BRFSS_2014_Data_Dictionary.xlsx,duplicate variable name in source codebook (2 rows)
BRFSS,2014,CSRELATE,M17.6. How are you related to the child?,,question,M17:  Random Child Selection,,OHA_BRFSS_2014_Data_Dictionary.xlsx,
BRFSS,2014,CADIAG,"M18.1. Has a doctor, nurse, or other health professional EVER said that the child has asthma?",,question,M18: Childhood Asthma Prevalence,,OHA_BRFSS_2014_Data_Dictionary.xlsx,
BRFSS,2014,CASTILL,M18.2. Does the child still have asthma?,,question,M18: Childhood Asthma Prevalence,,OHA_BRFSS_2014_Data_Dictionary.xlsx,
BRFSS,2014,SKINCANCER,C6.6. (Ever told) you had skin cancer?,,question,Cancer,,OHA_BRFSS_2014_Data_Dictionary.xlsx,
BRFSS,2014,OTHERCANCER,C6.7. (Ever told) you had any other types of cancer?,,question,Cancer,,OHA_BRFSS_2014_Data_Dictionary.xlsx,
BRFSS,2014,CANCERTYPE,"OR106.3. With your most recent diagnosis of cancer, what type of cancer was it?",,question,OR106: Cancer Prevalence - Type,,OHA_BRFSS_2014_Data_Dictionary.xlsx,
BRFSS,2014,CANCERTYPEO,Enter Other QOR106.3. Here:,,question,OR106: Cancer Prevalence - Type,,OHA_BRFSS_2014_Data_Dictionary.xlsx,
BRFSS,2014,CVATTACK,"Have you EVER been told by a doctor, nurse, or other health professional that you had a heart attack, also called myocardial infarction?",,question,Cardiovascular Disease,,OHA_BRFSS_2014_Data_Dictionary.xlsx,
BRFSS,2014,CVSTROKE,"Have you EVER been told by a doctor, nurse, or other health professional that you had a stroke?",,question,Cardiovascular Disease,,OHA_BRFSS_2014_Data_Dictionary.xlsx,
BRFSS,2014,CVANGINA,"Have you EVER been told by a doctor, nurse, or other health professional that you had angina or coronary disease?",,question,Cardiovascular Disease,,OHA_BRFSS_2014_Data_Dictionary.xlsx,
BRFSS,2014,COSTOOLT,C17.1. A blood stool test is a test that may use a special kit at home to determine whether the stool contains blood.  Have you ever had this test using a home kit?,,question,C17:  Colorectal Cancer Screening,,OHA_BRFSS_2014_Data_Dictionary.xlsx,
BRFSS,2014,COSTOOLW,C17.3. How long has it been since you had your last blood stool test using a home kit?,,question,C17:  Colorectal Cancer Screening,,OHA_BRFSS_2014_Data_Dictionary.xlsx,
BRFSS,2014,COSIG,C17.4. Sigmoidoscopy and colonoscopy are exams in which a tube is inserted in the rectum to view the colon for signs of cancer or other health problems.  Have you ever had either of these exams?,,question,C17:  Colorectal Cancer Screening,,OHA_BRFSS_2014_Data_Dictionary.xlsx,
BRFSS,2014,COTYPE,C17.5. Was your MOST RECENT exam a sigmoidoscopy or a colonoscopy?,,question,C17:  Colorectal Cancer Screening,,OHA_BRFSS_2014_Data_Dictionary.xlsx,
BRFSS,2014,COSIGLST,C17.6. How long has it been since you had your last sigmoidoscopy or colonoscopy?,,question,C17:  Colorectal Cancer Screening,,OHA_BRFSS_2014_Data_Dictionary.xlsx,
BRFSS,2014,rfbldst,Respondents ages 50+ who have not had a blood stool test within two years,,question,C17:  Colorectal Cancer Screening,,OHA_BRFSS_2014_Data_Dictionary.xlsx,
BRFSS,2014,rfsigm2,Respondents aged 50+ who have never had a Sigmoidoscopy or colonoscopy,,question,C17:  Colorectal Cancer Screening,,OHA_BRFSS_2014_Data_Dictionary.xlsx,
BRFSS,2014,COSTOOLTB2,"OR117.1. I just need to clarify a detail about the answer you just gave – was the stool test you were just referring to a test at home using a special kit, or did it happen in a medical setting, such as a doctor's office?",,question,OR117:  Colorectal Cancer Screening-State,,OHA_BRFSS_2014_Data_Dictionary.xlsx,
BRFSS,2014,COLOTALK,"OR108.1 In the past six months, have you had a conversation with anyone other than a health professional about colorectal cancer screening?",,question,OR108:  Colorectal Screening Awareness,,OHA_BRFSS_2014_Data_Dictionary.xlsx,
BRFSS,2014,COLOADV,"OR108.2 In the past year, do you recall seeing or hearing an advertisement to promote colorectal cancer screening that featured people from Oregon?",,question,OR108:  Colorectal Screening Awareness,,OHA_BRFSS_2014_Data_Dictionary.xlsx,
BRFSS,2014,DIABETES,C6.12. (Ever told) you have diabetes?,,question,Diabetes,,OHA_BRFSS_2014_Data_Dictionary.xlsx,
BRFSS,2014,DIAGE,C6.13. How old were you when you were told you have diabetes?,,question,Diabetes,,OHA_BRFSS_2014_Data_Dictionary.xlsx,
BRFSS,2014,PREDIABTEST,M1.1. Have you had a test for high blood sugar or diabetes within the past three years?,,question,M1:  Pre-Diabetes,,OHA_BRFSS_2014_Data_Dictionary.xlsx,
BRFSS,2014,PREDIABX,M1.2. Have you ever been told by a doctor or other health professional that you have pre-diabetes or borderline diabetes?,,question,M1:  Pre-Diabetes,,OHA_BRFSS_2014_Data_Dictionary.xlsx,
BRFSS,2014,EXWORKA2,"OR107.1 When you are at work, which of the following best describes what you do? Would you say ...",,question,OR107:  Exercise at Work,,OHA_BRFSS_2014_Data_Dictionary.xlsx,
BRFSS,2014,TRAVELWRK,OR136.1. About how far do you live from your work place?  Would you say...,,question,OR136: Commute to Work,,OHA_BRFSS_2014_Data_Dictionary.xlsx,
BRFSS,2014,DRIVEDAYS,"OR136.2. In the last week, how many days did you drive or ride in a car, truck or motorcycle to get to work?",,question,OR136: Commute to Work,,OHA_BRFSS_2014_Data_Dictionary.xlsx,
BRFSS,2014,BUSDAYS,"OR136.3. (In the last week,) how many days did you ride a bus, streetcar, light rail, or use another type of public transportation to get to work?",,question,OR136: Commute to Work,,OHA_BRFSS_2014_Data_Dictionary.xlsx,
BRFSS,2014,WALKDAYS,"OR136.4. (In the last week,) how many days did you walk to work?",,question,OR136: Commute to Work,,OHA_BRFSS_2014_Data_Dictionary.xlsx,
BRFSS,2014,BIKEDAYS,"OR136.5. (In the last week,) how many days did you ride a bike to work?",,question,OR136: Commute to Work,,OHA_BRFSS_2014_Data_Dictionary.xlsx,
BRFSS,2014,CHHIPRES,"OR57.1. Have you EVER been told by a doctor, nurse, or other health professional that you have high blood pressure?",,question,OR57:  Hypertension Awareness,,OHA_BRFSS_2014_Data_Dictionary.xlsx,
BRFSS,2014,CHTKEMED,OR57.2. Are you currently taking medicine for your high blood pressure?,,question,OR57:  Hypertension Awareness,,OHA_BRFSS_2014_Data_Dictionary.xlsx,
BRFSS,2014,FREQPOP2,"OR102.1. In the past 30 days, about how often do you drink regular soda or pop that contains sugar? Do NOT include diet soda or diet pop. (Times per day)",,question,OR 102:  SSB Consumption,,OHA_BRFSS_2014_Data_Dictionary.xlsx,
BRFSS,2014,FREQSSB2,"OR102.2. In the past 30 days, other than sodas, how often do you drink a can, bottle or glass of a sugar-sweetened beverage, such as Snapple, Gatorade, Red Bull, or a mocha? Do not include diet or sugar-free drinks. (Times per day)",,question,OR 102:  SSB Consumption,,OHA_BRFSS_2014_Data_Dictionary.xlsx,
BRFSS,2014,LIMITSSB,OR102.3. Are you currently trying to reduce or limit the amount of soda or other sugar-sweetened beverages that you drink? Please do not include diet or sugar-free sodas and other beverages.,,question,OR 102:  SSB Consumption,,OHA_BRFSS_2014_Data_Dictionary.xlsx,
BRFSS,2014,SALTWATCH,M06.1. Are you currently watching or reducing your sodium or salt intake?,,question,M06:  Sodium or Salt-Related Behavior,,OHA_BRFSS_2014_Data_Dictionary.xlsx,
BRFSS,2014,SALTLONG,"M06.2. How many days, weeks, months, or years have you been watching or reducing your sodium or salt intake?",,question,M06:  Sodium or Salt-Related Behavior,,OHA_BRFSS_2014_Data_Dictionary.xlsx,
BRFSS,2014,SALTADER,M06.3. Has a doctor or other health professional ever advised you to reduce salt intake?,,question,M06:  Sodium or Salt-Related Behavior,,OHA_BRFSS_2014_Data_Dictionary.xlsx,
BRFSS,2014,WATER,"OR135.1. During the past 30 days, how often did you drink a glass or bottle of plain water?  Count unflavored tap, bottled, and sparkling water.",,question,OR 135:  Water Consumption,,OHA_BRFSS_2014_Data_Dictionary.xlsx,
BRFSS,2014,SMOKE100,C9.1. Have you smoked at least 100 cigarettes in your entire life?,,question,Core 9:  Tobacco Use,,OHA_BRFSS_2014_Data_Dictionary.xlsx,
BRFSS,2014,SMOKE,"C9.2. Do you now smoke cigarettes every day, some days, or not at all?",,question,Core 9:  Tobacco Use,,OHA_BRFSS_2014_Data_Dictionary.xlsx,
BRFSS,2014,SMKQTYN,"C9.3. During the past 12 months, have you stopped smoking for one day or longer because you were trying to quit smoking?",,question,Core 9:  Tobacco Use,,OHA_BRFSS_2014_Data_Dictionary.xlsx,
BRFSS,2014,SMKLASTPUFFX,"C9.4. How long has it been since the last time you smoked a cigarette, even one or two puffs?",,question,Core 9:  Tobacco Use,,OHA_BRFSS_2014_Data_Dictionary.xlsx,
BRFSS,2014,CHEW,"C9.5. Do you currently use chewing tobacco, snuff or snus every day, some days, or not at all?",,question,Core 9:  Tobacco Use,,OHA_BRFSS_2014_Data_Dictionary.xlsx,
BRFSS,2014,rfsmok2,Risk factor: Respondents that reported having smoked at least 100 cigarettes in their lifetime and currently smoke - CDC,,question,Core 9:  Tobacco Use,,OHA_BRFSS_2014_Data_Dictionary.xlsx,
BRFSS,2014,smoker2,Computed Smoking Status - CDC,,question,Core 9:  Tobacco Use,,OHA_BRFSS_2014_Data_Dictionary.xlsx,
BRFSS,2014,SMQ1YEAR,"OR20.2. In your lifetime, have you ever quit smoking for one year or more?",,question,OR20:  Tobacco – Current Smoker Quit Patterns,,OHA_BRFSS_2014_Data_Dictionary.xlsx,
BRFSS,2014,QUITCON,OR20.3. Are you seriously considering stopping smoking within the next 6 months?,,question,OR20:  Tobacco – Current Smoker Quit Patterns,,OHA_BRFSS_2014_Data_Dictionary.xlsx,
BRFSS,2014,QUIT30,OR20.4. Are you planning to stop within the next 30 days?,,question,OR20:  Tobacco – Current Smoker Quit Patterns,,OHA_BRFSS_2014_Data_Dictionary.xlsx,
BRFSS,2014,SMQTLIKE2,OR20.5. Would you like to quit smoking?,,question,OR20:  Tobacco – Current Smoker Quit Patterns,,OHA_BRFSS_2014_Data_Dictionary.xlsx,
BRFSS,2014,SQTMTHD1X,"OR20.6. A product that contains nicotine, such as 'The Patch,' nicotine gum, nasal spray or lozenges?",,question,OR20:  Tobacco – Current Smoker Quit Patterns,,OHA_BRFSS_2014_Data_Dictionary.xlsx,
BRFSS,2014,SQTMTHD2X,"OR20.7. A prescription medication, such as Chantix, Zyban or Wellbutrin?",,question,OR20:  Tobacco – Current Smoker Quit Patterns,,OHA_BRFSS_2014_Data_Dictionary.xlsx,
BRFSS,2014,SQTMTHD3X,"OR20.8. A quit program such as quit classes, counseling or telephone coaching?",,question,OR20:  Tobacco – Current Smoker Quit Patterns,,OHA_BRFSS_2014_Data_Dictionary.xlsx,
BRFSS,2014,SQTMTHD8,"OR20.9. Electronic cigarettes, also known as e-cigs?",,question,OR20:  Tobacco – Current Smoker Quit Patterns,,OHA_BRFSS_2014_Data_Dictionary.xlsx,
BRFSS,2014,FQTMTHD1X,"OR21.1. A product that contains nicotine, such as 'The Patch,' nicotine gum, nasal spray or lozenges?  Do not include electronic cigarettes.",,question,OR21:  Former Smoker Quit Patterns,,OHA_BRFSS_2014_Data_Dictionary.xlsx,
BRFSS,2014,FQTMTHD2X,"OR21.2. A prescription medication, such as Chantix, Zyban or Wellbutrin?",,question,OR21:  Former Smoker Quit Patterns,,OHA_BRFSS_2014_Data_Dictionary.xlsx,
BRFSS,2014,FQTMTHD3X,"OR21.3. A quit program such as quit classes, counseling or telephone coaching?",,question,OR21:  Former Smoker Quit Patterns,,OHA_BRFSS_2014_Data_Dictionary.xlsx,
BRFSS,2014,FQTMTHD8,"OR21.4. Electronic cigarettes, also known as e-cigs?",,question,OR21:  Former Smoker Quit Patterns,,OHA_BRFSS_2014_Data_Dictionary.xlsx,
BRFSS,2014,SDOCASK2,"OR22.1. At your last visit to your health care provider, did someone ask you if you smoked or used other tobacco products, either by questionnaire or in person?",,question,OR22:  Tobacco – Health Services Advice,,OHA_BRFSS_2014_Data_Dictionary.xlsx,
BRFSS,2014,SAQUITV2,"OR22.2. At your last visit to your health care provider, were you advised to quit smoking or using tobacco?",,question,OR22:  Tobacco – Health Services Advice,,OHA_BRFSS_2014_Data_Dictionary.xlsx,
BRFSS,2014,SAQUITASSESS,"OR22.3. At your last visit to your health care provider, did they ask you if you were willing to quit?",,question,OR22:  Tobacco – Health Services Advice,,OHA_BRFSS_2014_Data_Dictionary.xlsx,
BRFSS,2014,SAQUITR2,"OR22.4. At your last visit to your health care provider, were you offered recommendations or assistance on how to quit?",,question,OR22:  Tobacco – Health Services Advice,,OHA_BRFSS_2014_Data_Dictionary.xlsx,
BRFSS,2014,OPCARTONX,"OR25.1. The last time you bought cigarettes, did you purchase them by the carton, by the pack, or did you buy loose tobacco to roll your own?",,question,OR25:  Tobacco – Purchase/Price Information,,OHA_BRFSS_2014_Data_Dictionary.xlsx,
BRFSS,2014,OPWHEREP,"OR25.2. Do you usually buy cigarettes inside Oregon, outside Oregon, or using the Internet or a mail-order source?",,question,OR25:  Tobacco – Purchase/Price Information,,OHA_BRFSS_2014_Data_Dictionary.xlsx,
BRFSS,2014,OPSTORE,OR25.3 In what type of store do you usually buy cigarettes?,,question,OR25:  Tobacco – Purchase/Price Information,,OHA_BRFSS_2014_Data_Dictionary.xlsx,
BRFSS,2014,OPSTOREO,Enter OR25.3. Other Here:,,question,OR25:  Tobacco – Purchase/Price Information,,OHA_BRFSS_2014_Data_Dictionary.xlsx,
BRFSS,2014,OPINTMO,"OR25.4. In the past year, have you bought cigarettes over the Internet, or using a mail-order source?",,question,OR25:  Tobacco – Purchase/Price Information,,OHA_BRFSS_2014_Data_Dictionary.xlsx,
BRFSS,2014,opintmo3,"Includes in a new, recoded variable, a third category for those who bought cigarettes over the Internet or used a mail-order source",,question,OR25:  Tobacco – Purchase/Price Information,,OHA_BRFSS_2014_Data_Dictionary.xlsx,
BRFSS,2014,SMOKENUM,"OR26.1. Earlier you said that you smoke cigarettes every day. On the average, about how many cigarettes a day do you now smoke? INTERVIEWER NOTE: 1 pack = 20 cigarettes INTERVIEWER NOTE: If respondent says a number higher than 75, please verify and record",,question,OR26: Cigarette Consumption,,OHA_BRFSS_2014_Data_Dictionary.xlsx,
BRFSS,2014,smokenu2,Recode of smokenum which asks every-day smokers how many cigarettes per average day are smoked,,question,OR26: Cigarette Consumption,,OHA_BRFSS_2014_Data_Dictionary.xlsx,
BRFSS,2014,SINITIATE,OR27.1. At what age did you first smoke part or all of a cigarette?,,question,OR27:  Tobacco Consumption Supplemental,,OHA_BRFSS_2014_Data_Dictionary.xlsx,
BRFSS,2014,SSTARTS2X,OR27.2. At what age did you start smoking regularly? (DO NOT READ) 75 = 75 or older (DO NOT READ) 77 = Don't know/Not sure (DO NOT READ) 88 = Never smoked regularly (DO NOT READ) 99 = Refused,,question,OR27:  Tobacco Consumption Supplemental,,OHA_BRFSS_2014_Data_Dictionary.xlsx,
BRFSS,2014,starts,Recode of sstarts2x:  At what age did you start smoking?,,question,OR27:  Tobacco Consumption Supplemental,,OHA_BRFSS_2014_Data_Dictionary.xlsx,
BRFSS,2014,SLSTOP,OR30.1. Are you seriously considering stopping the use of smokeless tobacco within the next 6 months?,,question,OR30:  Smokeless Tobacco,,OHA_BRFSS_2014_Data_Dictionary.xlsx,
BRFSS,2014,SLSTOP30,OR30.2. Are you planning to stop within the next 30 days?,,question,OR30:  Smokeless Tobacco,,OHA_BRFSS_2014_Data_Dictionary.xlsx,
BRFSS,2014,CIGARLARGE,"OR31.1. Have you smoked a full-sized cigar in the last month? Examples would be Dutch Master, White Owl, King Edward, or Muriel.",,question,OR31:  Cigar Prevalence,,OHA_BRFSS_2014_Data_Dictionary.xlsx,
BRFSS,2014,CIGARSMALL,"OR31.2. Have you smoked a smaller-sized cigar or a cigarillo in the last month?  Examples would be Swisher Sweets, Cheyenne, or Winchester.",,question,OR31:  Cigar Prevalence,,OHA_BRFSS_2014_Data_Dictionary.xlsx,
BRFSS,2014,SMOKEREP2,OR34.1. Do you ever use smokeless tobacco or electronic cigarettes in situations where you can't smoke cigarettes or where you would prefer not to smoke cigarettes?,,question,OR 34:  Smoking Replacemet,,OHA_BRFSS_2014_Data_Dictionary.xlsx,
BRFSS,2014,SMOKE1,OR37.1. Have you smoked part or all of one cigarette in your entire life?,,question,OR37:  Supplemental Smoking Prevalence and Social Smoking,,OHA_BRFSS_2014_Data_Dictionary.xlsx,
BRFSS,2014,SMFLAVOR2,"OR37.2. In the last year, did you smoke any type of tobacco which had added flavors, such as berry, vanilla, chocolate, lime, candy, or other sweets?  Include cigarettes, cigars, pipe tobacco, hookah, roll your own, or any other form of smoked tobacco.",,question,OR37:  Supplemental Smoking Prevalence and Social Smoking,,OHA_BRFSS_2014_Data_Dictionary.xlsx,
BRFSS,2014,SSROOM,"OR39.1. This question refers to how much time you spend in places where there is smoke, whether it is at home, at work or anywhere else.  In a typical week, how many hours are you in the same room where others are smoking? (DO NOT READ)  1 = 1 hour or less",,question,OR39:  Secondhand Smoke Mini,,OHA_BRFSS_2014_Data_Dictionary.xlsx,
BRFSS,2014,roomcat3,Recode of ssroom: How many hours per week spent in a room where people are smoking,,question,OR39:  Secondhand Smoke Mini,,OHA_BRFSS_2014_Data_Dictionary.xlsx,
BRFSS,2014,SQTLINEX,OR42.1. Have you ever heard about 1-800-QUITNOW?,,question,OR42: Tobacco - General Policy,,OHA_BRFSS_2014_Data_Dictionary.xlsx,
BRFSS,2014,SSMINOR,OR42.2. How important is it that communities keep stores from selling tobacco products to minors?  Would you say it is... (PLEASE READ LIST),,question,OR42: Tobacco - General Policy,,OHA_BRFSS_2014_Data_Dictionary.xlsx,
BRFSS,2014,SSINDUS,OR42.3. Which of the following statements best describes how you think the tobacco industry is being treated these days... (PLEASE READ LIST),,question,OR42: Tobacco - General Policy,,OHA_BRFSS_2014_Data_Dictionary.xlsx,
BRFSS,2014,SSHONEST,OR42.4. Do you think that the tobacco companies have been honest or dishonest with the public about the dangers of tobacco use?  Honest or Dishonest?  Very or somewhat?,,question,OR42: Tobacco - General Policy,,OHA_BRFSS_2014_Data_Dictionary.xlsx,
BRFSS,2014,SSENCOUR,OR42.5. Do you agree or disagree with the following statement: Cigarette companies deliberately advertise and promote cigarettes to encourage youth under 18 to smoke?  Agree or disagree? Strongly or somewhat?,,question,OR42: Tobacco - General Policy,,OHA_BRFSS_2014_Data_Dictionary.xlsx,
BRFSS,2014,COUPONGET,"OR111.1. In the last 30 days, did you receive tobacco coupons or other discounts in the mail, over the Internet, or from any other source?",,question,OR111:  Coupons/Merchandising,,OHA_BRFSS_2014_Data_Dictionary.xlsx,
BRFSS,2014,COUPONUSE,"OR111.2. In the last 30 days, did you buy any tobacco product using coupons, rebates, buy 1 get 1 free, or any other special promotions?",,question,OR111:  Coupons/Merchandising,,OHA_BRFSS_2014_Data_Dictionary.xlsx,
BRFSS,2014,HOOKAH30,"OR112.1. During the past 30 days, on how many days did you smoke tobacco in a hookah? (RANGE IS 1 TO 30 DAYS) (DO NOT READ) 77 = Don't know / Not sure (DO NOT READ) 88 = None (DO NOT READ) 99 = Refused",,question,OR112:  Hookah,,OHA_BRFSS_2014_Data_Dictionary.xlsx,
BRFSS,2014,TOBADV,"OR132.1. Thinking of the stores you have visited in the past 30 days, did you see any advertisements promoting cigarettes or other tobacco products on the storefront or inside the store?",,question,OR132:  Tobacco Advertising Exposure,,OHA_BRFSS_2014_Data_Dictionary.xlsx,
BRFSS,2014,TOBUNPUR1,"OR133.1. Since you quit smoking, has there been a time when seeing a tobacco product display in a store has given you the urge to buy tobacco?",,question,OR133:  Unplanned Tobacco Purchases,,OHA_BRFSS_2014_Data_Dictionary.xlsx,
BRFSS,2014,TOBUNPUR2,OR133.2. Was there a time in the past 30 days when you decided to buy cigarettes or other tobacco products at the last minute when you were shopping for other things?,,question,OR133:  Unplanned Tobacco Purchases,,OHA_BRFSS_2014_Data_Dictionary.xlsx,
BRFSS,2014,ECIGEVER,"OR134.1. Have you ever used an electronic cigarette in your entire life, even one or two puffs?",,question,OR134:  Electronic Cigarette Prevalence,,OHA_BRFSS_2014_Data_Dictionary.xlsx,
BRFSS,2014,ECIG30,"OR134.2. During the past 30 days, on how many days did you use an electronic cigarette?",,question,OR134:  Electronic Cigarette Prevalence,,OHA_BRFSS_2014_Data_Dictionary.xlsx,
BRFSS,2014,MENTHOL,OR137.1. Are the cigarettes you smoke menthol or non-menthol?,,question,OR137: Tobacco State-Added Menthol,,OHA_BRFSS_2014_Data_Dictionary.xlsx,
BRFSS,2014,SHSOUTTAV,OR138.1. While sitting outside at a restaurant or bar?,,question,OR138: Secondhand Smoke Exposure in Outdoor Venues,,OHA_BRFSS_2014_Data_Dictionary.xlsx,
BRFSS,2014,SHSOUTPARK,OR138.2. At a public park or playground?,,question,OR138: Secondhand Smoke Exposure in Outdoor Venues,,OHA_BRFSS_2014_Data_Dictionary.xlsx,
BRFSS,2014,SHSOUTPUB,"OR138.3. Outside a public building, such as a library, city hall, or courthouse?",,question,OR138: Secondhand Smoke Exposure in Outdoor Venues,,OHA_BRFSS_2014_Data_Dictionary.xlsx,
BRFSS,2014,SHSOUTFAIR,"OR138.4. At an outdoor concert, fair, rodeo or similar event which draws a crowd?",,question,OR138: Secondhand Smoke Exposure in Outdoor Venues,,OHA_BRFSS_2014_Data_Dictionary.xlsx,
BRFSS,2014,SHSOUTHARM,OR138.5. Would you say that breathing secondhard smoke WHILE OUTSIDE is:,,question,OR138: Secondhand Smoke Exposure in Outdoor Venues,,OHA_BRFSS_2014_Data_Dictionary.xlsx,
